{
  "schema_version": "1.0.0",
  "status": "draft",
  "trial_id": "SYNTHETIC_LONGITUDINAL_500",
  "title": "Synthetic longitudinal sustained-regime verification",
  "data_kind": "synthetic",
  "target_trial": {
    "population": "Generated independent units; not a biological trial",
    "eligibility": "All generated units enrolled before the first decision",
    "assignment_unit": "plot",
    "analysis_unit": "plot",
    "assignment": "Random assignment in the hypothetical target trial; the generated observational emulation depends on measured covariates",
    "time_zero": "Synthetic allocation origin",
    "time_unit": "d",
    "followup_end": 90,
    "strategies": [
      {
        "id": "A",
        "description": "Synthetic binary action 1 at the decision; sustained regime applies action 1 at every grid point"
      },
      {
        "id": "B",
        "description": "Synthetic binary action 0 at the decision; sustained regime applies action 0 at every grid point"
      }
    ],
    "outcome": {
      "variable_id": "response",
      "definition": "Generated continuous endpoint",
      "time": 90,
      "unit": "arbitrary"
    },
    "estimand": {
      "population": "All generated units",
      "contrast": "A-B",
      "effect": "mean_difference",
      "strategy_effect": "sustained_strategy",
      "intercurrent_events": "Loss to follow-up handled by explicitly selected IPCW"
    },
    "analysis_plan": "Sequential inverse treatment/observation weighting, static A-A-A versus B-B-B, Hajek means; cluster bootstrap"
  },
  "emulation": {
    "design": "observational",
    "eligibility_mapping": "units.tsv eligible=1; selection occurs before treatment",
    "assignment_mapping": "Generated observational actions depend on recorded covariates; they do not represent randomization",
    "time_zero_mapping": "Relative time zero is the first decision; baseline observations precede it",
    "strategy_mapping": "treatments.tsv records verified actual binary actions over the specified intervals",
    "outcome_mapping": "observations.tsv response at time=90, with explicit NA endpoint rows",
    "followup_mapping": "Relative days 0 through 90; loss is recorded on the explicit time grid",
    "estimand_mapping": "All-A versus all-B sustained static regimes",
    "analysis_mapping": "Use baseline_z and pre-decision time-varying history_l with MSM_IPW and IPCW",
    "limitations": [
      "Synthetic numerical verification only; no observed biological measurements"
    ]
  },
  "identification": {
    "exchangeability": "The generated data include measured common causes; real study identification still requires scientific review",
    "positivity": "Fitted support is checked; probabilities are not clipped",
    "consistency": "Binary actions and decision times are explicitly defined",
    "interference": "Generated units do not interact; interference must be reviewed for real studies"
  },
  "missing_data_plan": "Generated endpoint missingness is handled only by an explicitly selected policy; no automatic fill or row dropping",
  "provenance": {
    "source_id": "SYNTHETIC",
    "source_uri": "synthetic://longitudinal-causal-verification-500",
    "source_location": "generated",
    "license": "CC0-1.0",
    "retrieved_at": "2026-10-12",
    "transformations": "Generated by tools/generate_longitudinal_verification.py, numpy seed19127; no observed biological data"
  },
  "extensions": {
    "longitudinal": {
      "time_grid": [
        0,
        30,
        60,
        90
      ]
    }
  }
}
